{
  "$schema": "https://json-schema.org/draft/2020-12/schema",
  "$id": "https://unfolding.local/schemas/review.schema.json",
  "title": "Structured language-version review",
  "type": "object",
  "required": ["schemaVersion", "entryId", "locale", "reviewedAt", "originalSha256", "draftSha256", "summary", "checks", "issues"],
  "properties": {
    "schemaVersion": { "const": 2 },
    "entryId": { "type": "string" },
    "locale": { "enum": ["en", "ru"] },
    "reviewedAt": { "type": "string", "format": "date-time" },
    "originalSha256": { "type": "string", "pattern": "^[a-f0-9]{64}$" },
    "draftSha256": { "type": "string", "pattern": "^[a-f0-9]{64}$" },
    "summary": { "type": "string" },
    "checks": {
      "type": "array",
      "minItems": 5,
      "maxItems": 5,
      "items": {
        "type": "object",
        "required": ["category", "status", "explanation"],
        "properties": {
          "category": { "enum": ["language", "clarity", "logic", "factual_claims", "mathematics"] },
          "status": { "enum": ["reviewed", "not_applicable"] },
          "explanation": { "type": "string" }
        },
        "additionalProperties": false
      }
    },
    "issues": {
      "type": "array",
      "items": {
        "type": "object",
        "required": ["id", "category", "location", "explanation", "severity", "status"],
        "properties": {
          "id": { "type": "string" },
          "category": { "enum": ["language", "clarity", "logic", "factual_claims", "mathematics"] },
          "location": { "type": "object", "properties": { "paragraph": { "type": "integer", "minimum": 1 }, "fragment": { "type": "string" } }, "minProperties": 1 },
          "explanation": { "type": "string" },
          "severity": { "enum": ["note", "minor", "major", "blocking"] },
          "status": { "enum": ["open", "accepted", "dismissed", "resolved"] },
          "confidence": { "type": "number", "minimum": 0, "maximum": 1 }
        },
        "additionalProperties": false
      }
    }
  },
  "additionalProperties": false
}
