{
  "schemaVersion": 2,
  "entryId": "de798db4-28f6-4274-a2a1-7ad211f42762",
  "locale": "en",
  "reviewedAt": "2026-10-26T01:08:20+03:00",
  "originalSha256": "b9886f4ea6cf0d38fb55dcbbb1533602deaa98d676532b9bb1f4972ef692daa3",
  "draftSha256": "7466881cdbddb00682a398efe66d3fdb307a29ed74be39111494d341c7b0fd39",
  "summary": "Revision of the published version: in the introduction, \"in the next article\" is replaced by \"in a separate note\" as decided by the author. The rest of the text, the translations and the apparatus are unchanged; the published text stays as it is until an explicit publication. No substantial issues.",
  "checks": [
    {
      "category": "language",
      "status": "reviewed",
      "explanation": "One phrase in the introduction changed; the wording was approved by the author."
    },
    {
      "category": "clarity",
      "status": "reviewed",
      "explanation": "The promise no longer points to a 'next' article, which could turn out to be the journal entry."
    },
    {
      "category": "logic",
      "status": "reviewed",
      "explanation": "Consistent with the journal entry, which refers to a separate note, 'Making Room for the Unknown'."
    },
    {
      "category": "factual_claims",
      "status": "reviewed",
      "explanation": "No factual statements changed."
    },
    {
      "category": "mathematics",
      "status": "not_applicable",
      "explanation": "No mathematical expressions."
    }
  ],
  "issues": []
}
