{
  "schemaVersion": 2,
  "entryId": "2502f97d-e27a-4c57-b44f-0e196e2103bd",
  "locale": "en",
  "reviewedAt": "2026-08-11T16:00:48+03:00",
  "originalSha256": "d6796f97ecc92fe520b6cec4caf103a4f4f090183c583938562a2b8ec67f75f2",
  "draftSha256": "d6796f97ecc92fe520b6cec4caf103a4f4f090183c583938562a2b8ec67f75f2",
  "summary": "A clear, contemplative translation that preserves the atmosphere and open questions of the Russian original. It is ready for publication from the review perspective.",
  "checks": [
    {
      "category": "language",
      "status": "reviewed",
      "explanation": "The English is fluent and the concise fragments preserve the original's observational rhythm."
    },
    {
      "category": "clarity",
      "status": "reviewed",
      "explanation": "The sensory scene and closing questions are clear."
    },
    {
      "category": "logic",
      "status": "reviewed",
      "explanation": "This is reflective writing rather than an argument requiring a formal inferential structure."
    },
    {
      "category": "factual_claims",
      "status": "not_applicable",
      "explanation": "The entry presents direct experience and open questions, not externally verifiable claims."
    },
    {
      "category": "mathematics",
      "status": "not_applicable",
      "explanation": "No mathematical content."
    }
  ],
  "issues": []
}
