{
  "schemaVersion": 2,
  "entryId": "07491c92-d8d4-47de-aa3e-e07bbe918103",
  "locale": "en",
  "reviewedAt": "2026-08-11T04:01:48+03:00",
  "originalSha256": "929d52376c8f9d111225996f81b8146f5e30716573dbe0013528ada64c9e13f1",
  "draftSha256": "929d52376c8f9d111225996f81b8146f5e30716573dbe0013528ada64c9e13f1",
  "summary": "The entry presents a correct and clearly structured proof of the implication chain. The strategy matches the proof, both applications of Modus Ponens are valid, and Conditional Proof is applied correctly. No substantive issues were found.",
  "checks": [
    {
      "category": "language",
      "status": "reviewed",
      "explanation": "The English is grammatically correct, concise, and appropriate for a mathematical exposition."
    },
    {
      "category": "clarity",
      "status": "reviewed",
      "explanation": "The Statement, Strategy, Proof, and Remarks sections provide a clear progression from premises to conclusion."
    },
    {
      "category": "logic",
      "status": "reviewed",
      "explanation": "Assuming P, deriving Q and then R by two valid uses of Modus Ponens, and discharging the assumption to obtain P → R is logically sound."
    },
    {
      "category": "factual_claims",
      "status": "not_applicable",
      "explanation": "The entry contains a formal logical derivation rather than empirical or historical factual claims."
    },
    {
      "category": "mathematics",
      "status": "reviewed",
      "explanation": "The implication is valid, every inference is justified, the proof strategy is appropriate, and the LaTeX expressions are well formed."
    }
  ],
  "issues": []
}
