{
  "schemaVersion": 2,
  "entryId": "07491c92-d8d4-47de-aa3e-e07bbe918103",
  "locale": "ru",
  "reviewedAt": "2026-08-11T04:36:14+03:00",
  "originalSha256": "dab99f3c733960902a8c3eb6b0b1c69b9ce07b4022e9d09855972d1e337cc646",
  "draftSha256": "a68db58a1fe3e088bc6b2a2edb90d55263a46c14ccfbe56e5b45d112b00f9ea3",
  "summary": "Авторская редакция перевода точна, терминологически последовательна и математически корректна. Формулировки через правило введения импликации и правило отделения соответствуют структуре натурального вывода. Существенных замечаний нет.",
  "checks": [
    {
      "category": "language",
      "status": "reviewed",
      "explanation": "Русский текст грамматически корректен и выдержан в ясном учебно-математическом стиле."
    },
    {
      "category": "clarity",
      "status": "reviewed",
      "explanation": "Стратегия прямо называет предположение, требуемый вывод и завершающее правило; каждый шаг доказательства объяснён явно."
    },
    {
      "category": "logic",
      "status": "reviewed",
      "explanation": "Два применения правила отделения корректно дают Q и R, после чего правило введения импликации позволяет заключить P → R."
    },
    {
      "category": "factual_claims",
      "status": "not_applicable",
      "explanation": "Текст представляет формальный логический вывод и не содержит эмпирических или исторических утверждений."
    },
    {
      "category": "mathematics",
      "status": "reviewed",
      "explanation": "Посылки, формулы, обозначения и заключение корректны; LaTeX синтаксически согласован."
    }
  ],
  "issues": []
}
