{
  "schemaVersion": 2,
  "entryId": "644e0198-40f4-41b3-84d9-b0c4968e7ace",
  "locale": "ru",
  "reviewedAt": "2026-08-18T10:45:36+03:00",
  "originalSha256": "f10dda87316893004b525c0d56039f93821781c7fade77636ee8068a8ee3eaca",
  "draftSha256": "e91ed9f4e1be9a87a211cce596449e0ee5fafd24c9833823883752baecdfd040",
  "summary": "Авторский перевод последователен и соответствует английской версии. Ранее отмеченная смысловая шероховатость устранена, библиографические ссылки оформлены корректно. Существенных или блокирующих замечаний нет; версия готова к публикации с точки зрения ревью после решения автора.",
  "checks": [
    {
      "category": "language",
      "status": "reviewed",
      "explanation": "Русский текст написан естественно и выдержан в едином авторском регистре; санскритские термины оформлены последовательно."
    },
    {
      "category": "clarity",
      "status": "reviewed",
      "explanation": "Фраза о первых четырёх членах системы уточнена и теперь точно передаёт идею пути к следующим членам."
    },
    {
      "category": "logic",
      "status": "reviewed",
      "explanation": "Переход от личного опыта к выбору системы, текста и метода исследования последователен."
    },
    {
      "category": "factual_claims",
      "status": "reviewed",
      "explanation": "Исторические и текстологические утверждения сформулированы с необходимыми оговорками и согласуются с приведёнными академическими источниками; описания состояний представлены как личный опыт."
    },
    {
      "category": "mathematics",
      "status": "not_applicable",
      "explanation": "Математических утверждений и обозначений в записи нет."
    }
  ],
  "issues": []
}
