{
  "schemaVersion": 2,
  "entryId": "cdf83ba9-b77e-4af5-a5ab-eb0c83d83d5a",
  "locale": "ru",
  "reviewedAt": "2026-10-27T00:10:02+03:00",
  "originalSha256": "873eaef8d02c96bc0a90cd511c644ab00dafd453633e2ae5072a6fa4d04174f6",
  "draftSha256": "e89fa76bfefad641d1d111ce9f940055678a8fcf380796c96d88c2512c13b027",
  "summary": "Четвёртое ревью: первое предложение заменено выбранным автором вариантом («Уже приняв решение перевести *Pātañjalayogaśāstra* и приступив к работе…»), неоднозначность последовательности и повтор «самостоятельно» устранены. Ранее, в третьем ревью:«два перевода Pātañjalayogaśāstra» заменено на «два перевода „Йога-сутр“» (оформлено курсивом с кавычками, как в заметке о методологии), восстановлен курсив *Pātañjalayogaśāstra* в первом абзаце, «крийя-йога» со строчной буквы. Ранее: переписан первый абзац, уточнена традиция крийя-йоги, снят случайный курсив; длинное предложение и «на данный момент времени» оставлены по решению автора. Существенных и блокирующих замечаний нет: с точки зрения проверки версия готова к публикации. Открытыми остаются только прежние стилистические замечания на усмотрение автора.",
  "checks": [
    {
      "category": "language",
      "status": "reviewed",
      "explanation": "Правки встроены грамматически корректно; повтор названия и пропущенный курсив в первом абзаце устранены. Новое первое предложение с деепричастными оборотами построено правильно: их действия и действие сказуемого относятся к одному лицу.Стилистические замечания первого ревью, на которые автор не ответил, остаются на усмотрение автора."
    },
    {
      "category": "clarity",
      "status": "reviewed",
      "explanation": "Последовательность событий в первом абзаце теперь ясна: решение, начало работы, прослушивание, сравнение с оригиналом. Уточнение «линии Лахири Махасаи» снимает возможную путаницу с kriyāyoga из YS 2.1."
    },
    {
      "category": "logic",
      "status": "reviewed",
      "explanation": "Новый первый абзац согласован с остальным текстом: сравнение с оригиналом естественно ведёт к проблеме эквивалентов во втором абзаце. Различение «руководство к опыту можно передать словами, само проживание нельзя» снимает вопрос о финале."
    },
    {
      "category": "factual_claims",
      "status": "reviewed",
      "explanation": "Крийя-йога названа конкретно. Один из прослушанных переводов, по словам автора, принадлежит Свами Вивекананде: его «Раджа-йога» (1896) содержит перевод сутр с собственным комментарием, без бхашьи; формулировка «два перевода „Йога-сутр“» этому соответствует. Второй перевод не установлен, но по решению автора описан так же."
    },
    {
      "category": "mathematics",
      "status": "not_applicable",
      "explanation": "Математических выражений нет."
    }
  ],
  "issues": [
    {
      "id": "issue-1",
      "category": "factual_claims",
      "location": {
        "fragment": "я успела несколько раз прослушать два перевода Pātañjalayogaśāstra"
      },
      "explanation": "Перевод Вивекананды («Раджа-йога», 1896) охватывает сутры с его собственным комментарием, без бхашьи. По решению автора формулировка заменена на «два перевода „Йога-сутр“», что также убрало повтор названия.",
      "severity": "minor",
      "status": "resolved",
      "confidence": 0.8
    },
    {
      "id": "issue-2",
      "category": "language",
      "location": {
        "fragment": "самостоятельно перевести *Pātañjalayogaśāstra*"
      },
      "explanation": "Курсив названия в первом абзаце восстановлен по решению автора.",
      "severity": "minor",
      "status": "resolved",
      "confidence": 0.7
    },
    {
      "id": "issue-3",
      "category": "language",
      "location": {
        "fragment": "Уже приняв решение перевести *Pātañjalayogaśāstra* и приступив к работе"
      },
      "explanation": "Прежняя формулировка «Когда я … приступила к работе, я успела прослушать» допускала чтение «к моменту начала работы я уже прослушала», а «самостоятельно» повторялось в абзаце. Автор выбрал вариант 1; оба замечания устранены.",
      "severity": "note",
      "status": "resolved",
      "confidence": 0.5
    },
    {
      "id": "issue-4",
      "category": "language",
      "location": {
        "fragment": "в крийя-йоге линии Лахири Махасаи"
      },
      "explanation": "По решению автора «крийя-йога» пишется со строчной буквы, по общим правилам для названий направлений йоги.",
      "severity": "note",
      "status": "resolved",
      "confidence": 0.4
    },
    {
      "id": "issue-5",
      "category": "clarity",
      "location": {
        "fragment": "меняется моё прочтение текста и открываются горизонты ещё непознанного"
      },
      "explanation": "Случайный курсив, обрывавшийся на «открываются», снят по решению автора.",
      "severity": "minor",
      "status": "resolved"
    },
    {
      "id": "issue-6",
      "category": "factual_claims",
      "location": {
        "fragment": "например в крийя-йоге линии Лахири Махасаи"
      },
      "explanation": "Возможная путаница с kriyāyoga из YS 2.1 снята: автор назвал конкретную традицию.",
      "severity": "minor",
      "status": "resolved"
    },
    {
      "id": "issue-7",
      "category": "clarity",
      "location": {
        "fragment": "Но, сравнивая их с оригиналом, я всё больше ощущала"
      },
      "explanation": "Неоднозначная последовательность событий в первом абзаце устранена: автор переписал абзац.",
      "severity": "minor",
      "status": "resolved"
    },
    {
      "id": "issue-8",
      "category": "clarity",
      "location": {
        "fragment": "Несмотря на отсутствие в нём столь подробных инструкций"
      },
      "explanation": "Предложение оставлено цельным по решению автора.",
      "severity": "minor",
      "status": "dismissed"
    },
    {
      "id": "issue-9",
      "category": "language",
      "location": {
        "fragment": "на данный момент времени"
      },
      "explanation": "Формулировка оставлена по решению автора.",
      "severity": "minor",
      "status": "dismissed"
    },
    {
      "id": "issue-10",
      "category": "logic",
      "location": {
        "fragment": "непосредственно проживать опыт, который нельзя передать словами"
      },
      "explanation": "Автор пояснил: подходящих слов в русском и английском пока нет, и передать словами руководство к опыту и само проживание опыта это разные вещи. Сдвиг по отношению к седьмому абзацу намеренный.",
      "severity": "note",
      "status": "dismissed"
    },
    {
      "id": "issue-11",
      "category": "logic",
      "location": {
        "fragment": "она с большой долей вероятности будет соответствовать моему состоянию сознания"
      },
      "explanation": "Выбор значения объясняется только состоянием и установками переводчика, тогда как в заметке о методологии значение ограничивают также грамматика, словари и контекст. Если важно, одна фраза может уточнить, что возможные значения задаются словарями и контекстом, а открытым остаётся выбор между ними.",
      "severity": "note",
      "status": "open",
      "confidence": 0.4
    },
    {
      "id": "issue-12",
      "category": "clarity",
      "location": {
        "fragment": "по выбранной методологии перевода"
      },
      "explanation": "Читателю, пришедшему сразу на эту заметку, поможет ссылка на заметку «Методология исследования „Патанджала-йога-шастры“».",
      "severity": "note",
      "status": "open",
      "confidence": 0.5
    },
    {
      "id": "issue-13",
      "category": "language",
      "location": {
        "fragment": "Дело в том, что лично для меня"
      },
      "explanation": "Зачин «Дело в том, что» уже открывает третий абзац; здесь он не обязателен.",
      "severity": "note",
      "status": "open",
      "confidence": 0.6
    },
    {
      "id": "issue-14",
      "category": "language",
      "location": {
        "fragment": "непосредственное руководство к действию"
      },
      "explanation": "«Непосредственный» встречается четыре раза; в «руководстве к действию» у слова другой смысл. Вариант: «прямое» или «практическое руководство к действию».",
      "severity": "note",
      "status": "open",
      "confidence": 0.5
    },
    {
      "id": "issue-15",
      "category": "language",
      "location": {
        "fragment": "не пытаясь обязательно свести неизвестное к уже знакомому"
      },
      "explanation": "«Пытаясь обязательно» звучит неловко. Вариант: «не стремясь непременно свести неизвестное к уже знакомому».",
      "severity": "note",
      "status": "open",
      "confidence": 0.5
    },
    {
      "id": "issue-16",
      "category": "language",
      "location": {
        "fragment": "подсознательными установками и убеждениями"
      },
      "explanation": "В психологической терминологии устоялось «бессознательные установки»; «подсознательные» допустимо в разговорной речи.",
      "severity": "note",
      "status": "open",
      "confidence": 0.4
    }
  ]
}
