{
  "schemaVersion": 2,
  "entryId": "8a02df21-fcad-4a6f-b2a1-bc98ad061f8c",
  "locale": "ru",
  "reviewedAt": "2026-10-18T23:39:42+03:00",
  "originalSha256": "881e0f5f65a3b49d17d3e2e32ea935bf955e064b69202c7e130b6bf7ddfbe987",
  "draftSha256": "881e0f5f65a3b49d17d3e2e32ea935bf955e064b69202c7e130b6bf7ddfbe987",
  "summary": "Текст краткий, связный и грамматически чистый. Композиция ясна: ограниченность восприятия, вопрос о познании реальности, затем математика как возможный универсальный язык. Серьёзных замечаний нет, три пометки носят уточняющий характер и правок не требуют. Версия готова к публикации с точки зрения ревью. Блоки нумеруются без заголовка H1; жирный подзаголовок считается седьмым блоком.",
  "checks": [
    {
      "category": "language",
      "status": "reviewed",
      "explanation": "Орфография, пунктуация и синтаксис корректны. Единственное тире (блок 8) выполняет синтаксическую функцию. Повтор формулы «такой, какая она есть» в блоках 1 и 6 читается как осознанный рефрен."
    },
    {
      "category": "clarity",
      "status": "reviewed",
      "explanation": "Композиция ясна: ограниченность восприятия, вопрос о познании реальности, подзаголовок о математике, вывод. Подзаголовок оформлен жирным абзацем, как и в ряде прежних записей. Единственное уточнение касается многозначности ключевого понятия «человеческая форма»."
    },
    {
      "category": "logic",
      "status": "reviewed",
      "explanation": "Рассуждение последовательно. Главные утверждения о математике и об иных формах сознания поданы как возможность («возможно», «может оказаться», «я вижу возможность»), что соответствует степени их обоснованности. Ключевой шаг не аргументируется, см. замечание к блоку 8."
    },
    {
      "category": "factual_claims",
      "status": "reviewed",
      "explanation": "Проверены: узкий диапазон видимого излучения и существование инфракрасного и ультрафиолетового диапазонов; ограниченный диапазон слуха и животные, слышащие недоступные человеку звуки; время, за которое доходит свет далёких звёзд, и осторожная формулировка «могли уже перестать существовать»; реакция растений на свет, влажность, температуру и химические сигналы. Ошибок нет. Одна оговорка касается света, шедшего миллиарды лет (см. замечание). Называть реакции дерева «восприятием» спорно в физиологии растений, но автор ставит это как вопрос."
    },
    {
      "category": "mathematics",
      "status": "not_applicable",
      "explanation": "В тексте нет математических утверждений, формул и доказательств. О математике говорится в философском, а не в техническом ключе."
    }
  ],
  "issues": [
    {
      "id": "issue-1",
      "category": "factual_claims",
      "location": {
        "paragraph": 3,
        "fragment": "за тысячи, миллионы и даже миллиарды лет"
      },
      "explanation": "Для срока в миллиарды лет это верно прежде всего для галактик и квазаров: отдельные звёзды на таких расстояниях различимы лишь в исключительных случаях, например при гравитационном линзировании. Как обобщение формулировка допустима. Если нужна точность, можно сказать «свет далёких звёзд и галактик».",
      "severity": "note",
      "status": "open",
      "confidence": 0.7
    },
    {
      "id": "issue-2",
      "category": "logic",
      "location": {
        "paragraph": 8,
        "fragment": "математика позволяет исследовать абстрактные структуры и отношения, не привязанные к конкретному способу восприятия"
      },
      "explanation": "Ключевой шаг рассуждения (математика даёт доступ к закономерностям, не зависящим от человеческой формы) не обосновывается, а подаётся как личная позиция. Для короткой рефлексивной записи это уместно. Стоит помнить, что в философии математики есть и противоположный взгляд: математика как продукт человеческого познания. Предположение, что иные формы сознания смогут пользоваться тем же языком (блок 9), остаётся гипотезой, и автор это оговаривает словами «возможно» и «может оказаться».",
      "severity": "note",
      "status": "open",
      "confidence": 0.65
    },
    {
      "id": "issue-3",
      "category": "clarity",
      "location": {
        "paragraph": 8,
        "fragment": "закономерностям, которые не зависят от человеческой формы"
      },
      "explanation": "Ключевое понятие «человеческая форма» (оно же в заголовке и в финале) нигде не определено: из контекста оно читается как человеческое тело плюс способ восприятия и мышления. Если многозначность намеренна, менять ничего не нужно.",
      "severity": "note",
      "status": "open",
      "confidence": 0.5
    }
  ]
}
