{
  "schemaVersion": 2,
  "entryId": "4621bd84-17fb-404e-9d13-dff8c80357ff",
  "locale": "ru",
  "reviewedAt": "2026-08-11T03:11:37+03:00",
  "originalSha256": "0a5740de18569ec62011331ab252a380084cee2c2e2800012c15e6007e9cc3a6",
  "draftSha256": "70c539ddfb76e062b80715a3ac64395eb5f1104b3b6479879f9de0a85b500b01",
  "summary": "После изменения первого предложения текст сохраняет ясную и последовательную эпистемологическую мысль о границах применимости научных теорий. Существенных замечаний нет.",
  "checks": [
    {
      "category": "language",
      "status": "reviewed",
      "explanation": "Грамматика, синтаксис и стилистика корректны."
    },
    {
      "category": "clarity",
      "status": "reviewed",
      "explanation": "Новое первое предложение точнее задаёт возможность, а не широкое обобщение; основная мысль выражена ясно."
    },
    {
      "category": "logic",
      "status": "reviewed",
      "explanation": "Переход от необъяснимого факта к возможной неполноте описания логически последователен."
    },
    {
      "category": "factual_claims",
      "status": "reviewed",
      "explanation": "Формулировка «может начаться» является осторожным модальным утверждением и не требует отдельного подтверждения в рамках этой рефлексивной записи."
    },
    {
      "category": "mathematics",
      "status": "not_applicable",
      "explanation": "Математические утверждения и вычисления отсутствуют."
    }
  ],
  "issues": []
}
