{
  "schemaVersion": 2,
  "entryId": "fbbdb355-3e3f-4cc8-8c34-960c32f0bb38",
  "locale": "ru",
  "reviewedAt": "2026-08-16T03:52:57+03:00",
  "originalSha256": "a6179bd81c63011e2aea2684e75e4ba362edfadae2923850f3e5b86081d03682",
  "draftSha256": "f21432bf877df982194c739731cb3df0fa25051128a18cceba070cfcc8f4b01d",
  "summary": "Уточнение корректно вводит левую сумму Римана, явно объясняет индекс k, внутренний радиус r_k, ширину интервала и смысл знака суммы. Остальной математический вывод не изменён. Существенных открытых замечаний нет; с точки зрения review версия готова к публикации после отдельного явного решения автора.",
  "checks": [
    {
      "category": "language",
      "status": "reviewed",
      "explanation": "Русская формулировка грамматически корректна; термин «левая сумма Римана» употреблён в принятом математическом значении."
    },
    {
      "category": "clarity",
      "status": "reviewed",
      "explanation": "После формулы отдельно объяснены индекс k, значения r_k и Δr, а также операция, обозначенная знаком суммы."
    },
    {
      "category": "logic",
      "status": "reviewed",
      "explanation": "Добавленное пояснение согласуется с последующей подстановкой внутренних радиусов и не меняет структуру вывода."
    },
    {
      "category": "factual_claims",
      "status": "not_applicable",
      "explanation": "Изменение не содержит эмпирических или исторических утверждений."
    },
    {
      "category": "mathematics",
      "status": "reviewed",
      "explanation": "Сумма с k от 0 до n−1 действительно является левой суммой Римана для функции 2πr на [0,1]; r_k=k/n и Δr=1/n указаны верно."
    }
  ],
  "issues": []
}
