{
  "schemaVersion": 2,
  "entryId": "35f1337a-336e-47d5-a598-728023189675",
  "locale": "ru",
  "reviewedAt": "2026-10-26T01:16:40+03:00",
  "originalSha256": "c38626355ea48d7748defd79f24f3d3a3708591f38b859f5ac0362acaac725fe",
  "draftSha256": "c38626355ea48d7748defd79f24f3d3a3708591f38b859f5ac0362acaac725fe",
  "summary": "Журнальная запись по утверждённой редакции: факты сверены с исследовательскими материалами и результатами проверок YS 1.1 (замечания предыдущего ревью учтены). Существенных замечаний нет: версия готова к публикации с точки зрения проверки.",
  "checks": [
    {
      "category": "language",
      "status": "reviewed",
      "explanation": "Текст утверждён автором; термины курсивом."
    },
    {
      "category": "clarity",
      "status": "reviewed",
      "explanation": "Структура: задача, метод и результаты, инструменты, проверка, границы, открытые вопросы, YS 1.2, итог."
    },
    {
      "category": "logic",
      "status": "reviewed",
      "explanation": "Недоказанное названо недоказанным; выводы в границах проверенного."
    },
    {
      "category": "factual_claims",
      "status": "reviewed",
      "explanation": "Числа, источники и результаты проверок сверены с материалами исследования; все 7 ссылок открываются."
    },
    {
      "category": "mathematics",
      "status": "not_applicable",
      "explanation": "Математических выражений нет."
    }
  ],
  "issues": []
}
