{
  "schemaVersion": 2,
  "entryId": "de798db4-28f6-4274-a2a1-7ad211f42762",
  "locale": "ru",
  "reviewedAt": "2026-10-26T01:08:19+03:00",
  "originalSha256": "9ec3eae3bf80bde9246f029838c0069efc4d1c9d6c6d514b7a93498b8e499f2c",
  "draftSha256": "ba5629499eb72ed5bbf03e7a77c989d59249835ba19777e6208b59817dc20167",
  "summary": "Ревизия опубликованной версии: во вступлении «в следующей заметке» заменено на «в отдельной заметке» по решению автора. Остальной текст, переводы и аппарат не изменены; опубликованный текст остаётся прежним до явной публикации. Существенных замечаний нет.",
  "checks": [
    {
      "category": "language",
      "status": "reviewed",
      "explanation": "Изменено одно слово во вступлении; формулировка утверждена автором."
    },
    {
      "category": "clarity",
      "status": "reviewed",
      "explanation": "Обещание больше не указывает на «следующую» заметку, которой может оказаться журнальная запись."
    },
    {
      "category": "logic",
      "status": "reviewed",
      "explanation": "Согласуется с журнальной записью, которая отсылает к отдельной заметке «Сохранить место неизвестного»."
    },
    {
      "category": "factual_claims",
      "status": "reviewed",
      "explanation": "Фактические утверждения не менялись."
    },
    {
      "category": "mathematics",
      "status": "not_applicable",
      "explanation": "Математических выражений нет."
    }
  ],
  "issues": []
}
