{
  "schemaVersion": 2,
  "entryId": "2502f97d-e27a-4c57-b44f-0e196e2103bd",
  "locale": "ru",
  "reviewedAt": "2026-08-11T16:33:34+03:00",
  "originalSha256": "a4e0913ab72c088a48263ab8bf1b4577e534d9b90362ac59a9f1562106edffe6",
  "draftSha256": "fb176fabc7620e50a26b85da8d3c37aeea2bd3bf9d052425ec3efb02c55a33a1",
  "summary": "The revised Russian entry remains clear and contemplative. The added seasonal detail is natural and does not introduce a review concern.",
  "checks": [
    {
      "category": "language",
      "status": "reviewed",
      "explanation": "«Летняя ночь без сна» is natural and fits the observational rhythm."
    },
    {
      "category": "clarity",
      "status": "reviewed",
      "explanation": "The seasonal detail makes the opening image more specific."
    },
    {
      "category": "logic",
      "status": "reviewed",
      "explanation": "This is reflective writing rather than a formal argument."
    },
    {
      "category": "factual_claims",
      "status": "not_applicable",
      "explanation": "The entry presents direct experience and open questions."
    },
    {
      "category": "mathematics",
      "status": "not_applicable",
      "explanation": "No mathematical content."
    }
  ],
  "issues": []
}
